<?xml version="1.0" ?>
<!DOCTYPE NODESet
  SYSTEM 'Morfeas.dtd'>
<NODESet>
        <CHANNEL>
                <ISO_CHANNEL>TE1</ISO_CHANNEL>
                <INTERFACE_TYPE>SDAQ</INTERFACE_TYPE>
                <ANCHOR>1.CH1</ANCHOR>
                <DESCRIPTION>This is a test 1</DESCRIPTION>
                <MIN>0</MIN>
                <MAX>200</MAX>
        </CHANNEL>
        <CHANNEL>
                <ISO_CHANNEL>TE2</ISO_CHANNEL>
                <INTERFACE_TYPE>SDAQ</INTERFACE_TYPE>
                <ANCHOR>2.CH1</ANCHOR>
                <DESCRIPTION>This is a test 2</DESCRIPTION>
                <MIN>-100.55</MIN>
                <MAX>300</MAX>
        </CHANNEL>
        <CHANNEL>
                <ISO_CHANNEL>TE3</ISO_CHANNEL>
                <INTERFACE_TYPE>SDAQ</INTERFACE_TYPE>
                <ANCHOR>3.CH1</ANCHOR>
                <DESCRIPTION>This is a test 3</DESCRIPTION>
                <MIN>0</MIN>
                <MAX>500</MAX>
        </CHANNEL>
        <CHANNEL>
                <ISO_CHANNEL>TE4</ISO_CHANNEL>
                <INTERFACE_TYPE>SDAQ</INTERFACE_TYPE>
                <ANCHOR>4.CH1</ANCHOR>
                <DESCRIPTION>This is a test 4</DESCRIPTION>
                <MIN>0</MIN>
                <MAX>500</MAX>
        </CHANNEL>
        <CHANNEL>
                <ISO_CHANNEL>TE567</ISO_CHANNEL>
                <INTERFACE_TYPE>SDAQ</INTERFACE_TYPE>
                <ANCHOR>626191848.CH1</ANCHOR>
                <DESCRIPTION>Test ISO channel for S/N:626191848</DESCRIPTION>
                <MIN>0</MIN>
                <MAX>500</MAX>
        </CHANNEL>
        <CHANNEL>
                <ISO_CHANNEL>TE89a</ISO_CHANNEL>
                <INTERFACE_TYPE>SDAQ</INTERFACE_TYPE>
                <ANCHOR>624642519.CH5</ANCHOR>
                <DESCRIPTION>Test ISO channel for S/N:624642519</DESCRIPTION>
                <MIN>0</MIN>
                <MAX>500</MAX>
        </CHANNEL>
        <CHANNEL>
                <ISO_CHANNEL>TE100_RX</ISO_CHANNEL>
                <INTERFACE_TYPE>IOBOX</INTERFACE_TYPE>
                <ANCHOR>117440522.RX1.CH1</ANCHOR>
                <DESCRIPTION>Test ISO channel for IOBOX</DESCRIPTION>
                <MIN>-40</MIN>
                <MAX>1500</MAX>
                <UNIT>°C</UNIT>
        </CHANNEL>
        <!--
                IOBOX RX link metrics use the same CHANNEL schema. UNIT is
                required and must be non-empty for every IOBOX/MTI/NOX
                CHANNEL, including Status;
                there is no per-anchor-kind exemption:
                <ANCHOR>{Identifier}.RX{n}.Status</ANCHOR>  MIN=0 MAX=1 UNIT=bool
                <ANCHOR>{Identifier}.RX{n}.Success</ANCHOR> MIN=0 MAX=100 UNIT=%
                Create concrete entries through the LOG-web linker UI.
        -->
        <!--
                MDAQ device type is retired and INTERFACE_TYPE="MDAQ" is rejected
                by the strict validator (unsupported_interface). A previous
                example MDAQ channel used to be here; it has been removed so
                this default configuration stays valid.
        -->
<!---->
</NODESet>
